{
  "schema_version": "v1",
  "outcome_id": "OL-0005",
  "candidate_id": "H-004",
  "lifecycle_state_during_window": "in_research",
  "evaluation_window_start": null,
  "evaluation_window_end": null,
  "outcome_kind": "research_oos",
  "metrics": {
    "sharpe": 0.746191460507614,
    "source_field": "trial_log.oos_sharpe",
    "window_convention": "No separate IS/OOS split convention existed in repo truth; this object records full-period baseline metrics from DEC-0004 and the H-004 experiment notebook.",
    "max_drawdown": 0.697949870640699,
    "n_obs": 2292,
    "trades": 41,
    "hit_rate": 0.5365853658536586,
    "profit_factor": 1.5037466064620668,
    "final_equity": 49897.77544811701,
    "total_pnl": 39897.77544811701,
    "gross_pnl": 53747.65000000001,
    "fees_paid": 1734.0594600000002,
    "slippage_paid": 867.0297300000001,
    "funding_paid": 11248.78536188244,
    "cost_drag_fraction": 0.2576833508419891,
    "dsr": 1.0,
    "walk_forward_efficiency": 1.0,
    "gates_passed": 5,
    "gates_total": 8
  },
  "data_provenance": {
    "source_data_refs": [
      "1d OHLCV stream: ohlcv_1d",
      "BTCUSDT 1d full history: data/processed/binance_um_perp_BTCUSDT_1d_2020-01-01_2026-04-11_2026-04-12T1655Z.parquet",
      "BTCUSDT funding rates full history supplied for funding cashflows: data/processed/binance_um_perp_BTCUSDT_funding_8h_2019-09-10_2026-04-12_2026-04-12T1655Z.parquet",
      "No separate IS/OOS split convention existed in repo truth for this baseline; DEC-0004 records full-period Sharpe in both trial-log Sharpe fields"
    ],
    "source_data_window_start": null,
    "source_data_window_end": null,
    "source_data_notes": "Copied from EXP-0005 data_requirements; no formal source-data window endpoints are committed for this baseline."
  },
  "derivation_record": {
    "derivation_method": "from_rep_artifact",
    "source_artifact_id": "REP-0005",
    "source_artifact_path": "research/experiments/REP-0005.report.json",
    "derivation_timestamp": "2026-05-04T18:30:00Z"
  },
  "pipeline_version": "pre_wp_5b",
  "linked_artifacts": [
    "EXP-0005",
    "REP-0005"
  ],
  "retrospective_flag": true,
  "linked_advisory_artifacts": [],
  "notes": "WP-9n retrospective backfill maps H-004 / REP-0005 / EXP-0005 as pre_wp_5b; source EXP/REP truth preserves the no-formal-split window convention. H-004 split is explicit; this entry remains distinct from REP-0011 post-WP-5b evidence.",
  "retrospective_disclosure": "WP-9n derives this outcome-ledger artifact after the fact from the already committed REP-0005 report as part of the retrospective REP-derived outcome-ledger backfill. REP remains the authoritative research record. This artifact carries no promotion, demotion, policy, REC/reconciliation, paper/live, runtime, deployment, strategy adjustment, or protected-path authority."
}
