{
  "schema_version": "v1",
  "outcome_id": "OL-0023",
  "candidate_id": "H-005",
  "lifecycle_state_during_window": "in_research",
  "evaluation_window_start": "2022-04-12",
  "evaluation_window_end": "2023-04-11",
  "outcome_kind": "research_oos",
  "metrics": {
    "source_field": "trial_log.oos_sharpe",
    "window_convention": "WP-12by / WP-S2c-31 uses the next prior contiguous equivalent-length non-cloned evaluation window before REP-0022, 2022-04-12 through 2023-04-11, as the second additional H-005 exp_success_criteria observation after the original full-period no-formal-split baseline and two H-005 D2 observations. Indicators are warmed up on prior available history, but the backtest window starts flat with no pre-window position carry-in. The original H-005 REP-0001 evidence used a full-period retrospective posture, so strict non-overlap against that baseline is impossible; this report records explicit non-cloned bounded-window disclosure for additional REP evidence.",
    "sharpe": -0.9662607347499566,
    "max_drawdown": 1.0,
    "n_obs": 5205,
    "trades": 94,
    "hit_rate": 0.35106382978723405,
    "profit_factor": 0.6370328077152783,
    "final_equity": 0.0,
    "total_pnl": -10000.0,
    "gross_pnl": -7291.950695160002,
    "fees_paid": 1800.1746799999987,
    "slippage_paid": 900.0873399999994,
    "funding_paid": 7.787284840000006,
    "cost_drag_fraction": -0.3713751529666065,
    "dsr": 0.0,
    "walk_forward_efficiency": 0.0,
    "gates_passed": 1,
    "gates_total": 8,
    "funding_events_applied": 197,
    "config_sha256": "c3400e35d72a5b4c39934e84e02e87b27422f0179d7773e0c281948ba618d4fd",
    "dataset_sha256": "3ea0c8be1ef4132516c6d2acd89b7d5dc8348364df2da53b944c33c031a39910",
    "dsr_note": "P(SR>1.0)=0.0000; SR benchmark=0.6142",
    "max_drawdown_peak": "2022-05-09 23:59:59.999000+00:00",
    "max_drawdown_trough": "2022-11-14 21:59:59.999000+00:00",
    "skipped_bars": 0,
    "sensitivity_min_ratio": -1.5762481974388216,
    "short_side_trades": 55,
    "short_side_net_pnl": -4814.374775160001,
    "long_side_trades": 39,
    "long_side_net_pnl": -3823.0320600000014,
    "trial_count_before_append": 22,
    "trial_count_after_append": 23
  },
  "data_provenance": {
    "source_data_refs": [
      "data/processed/binance_um_perp_BTCUSDT_1h_2020-01-01_2026-04-11_2026-04-12T1655Z.parquet",
      "data/processed/binance_um_perp_BTCUSDT_funding_8h_2019-09-10_2026-04-12_2026-04-12T1655Z.parquet",
      "binance_um_perp_BTCUSDT_1h_2020-01-01_2026-04-11_2026-04-12T1655Z",
      "binance_um_perp_BTCUSDT_funding_8h_2019-09-10_2026-04-12_2026-04-12T1655Z"
    ],
    "source_data_window_start": "2022-04-12",
    "source_data_window_end": "2023-04-11",
    "source_data_notes": "OL-0023 derives from REP-0023. REP-0023 used the next prior contiguous equivalent-length non-cloned evaluation window before REP-0022, covering 2022-04-12 through 2023-04-11, with actual bars from 2022-04-12 00:59:59.999000+00:00 through 2023-04-11 23:59:59.999000+00:00. Indicators were warmed up on prior available history, and the backtest window started flat with no pre-window position carry-in. The original H-005 evidence used a full-period no-formal-split retrospective baseline, so strict non-overlap against that baseline is impossible."
  },
  "derivation_record": {
    "derivation_method": "from_rep_artifact",
    "source_artifact_id": "REP-0023",
    "source_artifact_path": "research/experiments/REP-0023.report.json",
    "derivation_timestamp": "2026-05-22T08:58:38-06:00"
  },
  "pipeline_version": "pre_wp_5b",
  "linked_artifacts": [
    "EXP-0001",
    "REP-0023"
  ],
  "retrospective_flag": false,
  "linked_advisory_artifacts": [],
  "notes": "WP-12bz derives OL-0023 from committed REP-0023 only. It covers H-005 / research_oos / pre_wp_5b / downstream exp_success_criteria evidence production. REP-0023 records liquidation / final equity zero, liquidation_timestamp = 2022-11-14 21:59:59.999000+00:00, bars = 8760, actual bars from 2022-04-12 00:59:59.999000+00:00 through 2023-04-11 23:59:59.999000+00:00, indicator warmup on prior available history, flat start with no pre-window carry-in, pnl_concentration_90d = 0.8342041950903025, sensitivity array details with min_ratio = -1.5762481974388216, signal_counts = {-1.0: 972, 0.0: 7168, 1.0: 620}, and REP-stage no OL/REC/reconciliation_count movement. OL v1 carries no liquidation timestamp, PnL concentration, sensitivity-array, signal-count, or bar-count fields, so those REP facts are preserved here as descriptive notes rather than invented metrics. WP-12bz creates no REP or REC, does not increase reconciliation_count, does not satisfy REC-5, does not floor-cross the segment, does not complete H-005, and does not complete A2C-001. It does not apply or authorize R1 paired-source reuse or R2 batched-cycle methodology, and it does not authorize H-006 work, Path B, EXP scaffold authoring, cohort implementation beyond this OL append, AUTO successor work, policy, scoring, ranking/recommendation, paper-live, runtime, lifecycle, promotion, demotion, readiness, protected-path authority, downstream authority, or REC comparison logic. REP-0023 next_step_recommendation is schema-required only and is not authority."
}
