{
  "schema_version": "v1",
  "outcome_id": "OL-0027",
  "candidate_id": "H-002",
  "lifecycle_state_during_window": "in_research",
  "evaluation_window_start": "2024-04-12",
  "evaluation_window_end": "2025-04-11",
  "outcome_kind": "research_oos",
  "metrics": {
    "source_field": "trial_log.oos_sharpe",
    "window_convention": "WP-12dj / WP-S2c-73 uses the prior contiguous local data-year evaluation window, 2024-04-12 through 2025-04-11, as H-002 combined R1+R2 cycle 2 after WP-12di cycle 1 used 2025-04-12 through 2026-04-11. Indicators are warmed up on prior available 4h history, but the backtest window starts flat with no pre-window position carry-in. The original H-002 REP-0003 evidence used a full-period retrospective posture, so strict non-overlap against that baseline is impossible; this report records explicit non-cloned bounded-window disclosure for additional REP evidence.",
    "sharpe": 1.2836100531356018,
    "max_drawdown": 1.0,
    "n_obs": 2176,
    "trades": 50,
    "hit_rate": 0.34,
    "profit_factor": 0.9128514890628174,
    "final_equity": 0.0,
    "total_pnl": -10000.0,
    "gross_pnl": -5471.8771627209935,
    "fees_paid": 3021.1506000000004,
    "slippage_paid": 1510.5753000000002,
    "funding_paid": -3.603062720999869,
    "cost_drag_fraction": -0.8275264050385419,
    "dsr": 1.0,
    "walk_forward_efficiency": 1.0,
    "gates_passed": 4,
    "gates_total": 8,
    "funding_events_applied": 1094,
    "config_sha256": "3d09293e07297c941e5e829beee9b9eadfac66d20943cb2ac65f2859deeeb850",
    "dataset_sha256": "9c52bdd9b90a5c4c3f3857ee39de6941f0bd6de038007dc712616f5d6618fb87",
    "dsr_note": "P(SR>1.0)=1.0000; SR benchmark=0.6368",
    "max_drawdown_peak": "2024-11-22 07:59:59.999000+00:00",
    "max_drawdown_trough": "2025-04-09 19:59:59.999000+00:00",
    "skipped_bars": 0,
    "sensitivity_min_ratio": 0.5635580577762792,
    "short_side_trades": 25,
    "short_side_net_pnl": -9027.306642721001,
    "long_side_trades": 25,
    "long_side_net_pnl": 1310.8768200000077,
    "trial_count_before_append": 26,
    "trial_count_after_append": 27
  },
  "data_provenance": {
    "source_data_refs": [
      "data/processed/binance_um_perp_BTCUSDT_4h_2020-01-01_2026-04-11_2026-04-12T1655Z.parquet",
      "data/processed/binance_um_perp_BTCUSDT_funding_8h_2019-09-10_2026-04-12_2026-04-12T1655Z.parquet",
      "binance_um_perp_BTCUSDT_4h_2020-01-01_2026-04-11_2026-04-12T1655Z",
      "binance_um_perp_BTCUSDT_funding_8h_2019-09-10_2026-04-12_2026-04-12T1655Z"
    ],
    "source_data_window_start": "2024-04-12",
    "source_data_window_end": "2025-04-11",
    "source_data_notes": "OL-0027 derives from REP-0027. REP-0027 used the prior contiguous local data-year evaluation window, covering 2024-04-12 through 2025-04-11, with actual bars from 2024-04-12 03:59:59.999000+00:00 through 2025-04-11 23:59:59.999000+00:00. Indicators were warmed up on prior available 4h history, and the backtest window started flat with no pre-window position carry-in. WP-12di cycle 1 used 2025-04-12 through 2026-04-11. The original H-002 REP-0003 evidence used a full-period no-formal-split retrospective baseline, so strict non-overlap against that baseline is impossible."
  },
  "derivation_record": {
    "derivation_method": "from_rep_artifact",
    "source_artifact_id": "REP-0027",
    "source_artifact_path": "research/experiments/REP-0027.report.json",
    "derivation_timestamp": "2026-05-25T23:40:00Z"
  },
  "pipeline_version": "pre_wp_5b",
  "linked_artifacts": [
    "EXP-0003",
    "REP-0027"
  ],
  "retrospective_flag": false,
  "linked_advisory_artifacts": [],
  "notes": "WP-12dj derives OL-0027 from committed REP-0027 only. It is the shared source OL for two separate H-002 RECs under approved R1 paired-source reuse and approved R2 batched-cycle methodology: REC-0041 for d2_006_gates and REC-0042 for exp_success_criteria. REP-0027 records liquidation with final_equity = 0.0 and liquidation_timestamp = 2025-04-09 19:59:59.999000+00:00; OL v1 carries those facts here as descriptive notes because liquidated and liquidation_timestamp are not supported metrics fields. REP-0027 records gross_pnl <= 0 and cost_drag_fraction = -0.8275264050385419; deterministic REC comparison treats gross-PnL-negative cost drag as undefined or misleading rather than healthy cost behavior. WP-12dj records exact-segment REC-5 floor evidence for the two selected H-002 exact segments only and does not authorize H-002 completion, A2C-002 completion, Path B, A2C-003, Phase 3, policy, scoring, ranking/recommendation, paper-live, runtime, lifecycle, approval/readiness, protected-path authority, or downstream authority."
}
