{
  "schema_version": "v1",
  "outcome_id": "OL-0010",
  "candidate_id": "H-010",
  "lifecycle_state_during_window": "in_research",
  "evaluation_window_start": null,
  "evaluation_window_end": null,
  "outcome_kind": "research_oos",
  "metrics": {
    "sharpe": 0.46477526210643,
    "source_field": "trial_log.oos_sharpe",
    "window_convention": "No separate IS/OOS split convention existed in repo truth; this object records full-period baseline metrics from DEC-0010 and the H-010 experiment notebook.",
    "max_drawdown": 0.8497227861150672,
    "n_obs": 13757,
    "trades": 345,
    "hit_rate": 0.4985507246376812,
    "profit_factor": 1.0656445568132804,
    "final_equity": 14400.467066539371,
    "total_pnl": 4400.467066539371,
    "gross_pnl": 18228.50000000011,
    "fees_paid": 12883.662231999995,
    "slippage_paid": 6441.831115999998,
    "funding_paid": -5497.460414539095,
    "cost_drag_fraction": 0.7585941209348446,
    "dsr": 0.99827,
    "walk_forward_efficiency": 1.0,
    "gates_passed": 3,
    "gates_total": 8
  },
  "data_provenance": {
    "source_data_refs": [
      "4h OHLCV execution price stream: ohlcv_4h",
      "4h mark price stream: mark_price_4h",
      "4h index price stream: index_price_4h",
      "4h premium index stream: premium_index_4h",
      "8h funding-rate stream for cashflow accounting: funding_8h",
      "BTCUSDT mark price 4h history: data/processed/binance_um_perp_BTCUSDT_mark_price_4h_2019-12-23_2026-04-11_2026-04-12T2349Z.parquet",
      "BTCUSDT index price 4h history: data/processed/binance_um_perp_BTCUSDT_index_price_4h_2019-12-23_2026-04-11_2026-04-13T0043Z.parquet",
      "BTCUSDT premium index 4h history: data/processed/binance_um_perp_BTCUSDT_premium_index_4h_2019-12-24_2026-04-11_2026-04-13T0154Z.parquet",
      "No separate IS/OOS split convention existed in repo truth for this baseline; DEC-0010 records full-period Sharpe in both trial-log Sharpe fields"
    ],
    "source_data_window_start": null,
    "source_data_window_end": null,
    "source_data_notes": "Copied from EXP-0010 data_requirements; no formal source-data window endpoints are committed for this baseline."
  },
  "derivation_record": {
    "derivation_method": "from_rep_artifact",
    "source_artifact_id": "REP-0010",
    "source_artifact_path": "research/experiments/REP-0010.report.json",
    "derivation_timestamp": "2026-05-04T18:30:00Z"
  },
  "pipeline_version": "pre_wp_5b",
  "linked_artifacts": [
    "EXP-0010",
    "REP-0010"
  ],
  "retrospective_flag": true,
  "linked_advisory_artifacts": [],
  "notes": "WP-9n retrospective backfill maps H-010 / REP-0010 / EXP-0010 as pre_wp_5b; source EXP/REP truth preserves the no-formal-split window convention.",
  "retrospective_disclosure": "WP-9n derives this outcome-ledger artifact after the fact from the already committed REP-0010 report as part of the retrospective REP-derived outcome-ledger backfill. REP remains the authoritative research record. This artifact carries no promotion, demotion, policy, REC/reconciliation, paper/live, runtime, deployment, strategy adjustment, or protected-path authority."
}
