{
  "schema_version": "v1",
  "outcome_id": "OL-0018",
  "candidate_id": "H-001",
  "lifecycle_state_during_window": "in_research",
  "evaluation_window_start": "2023-04-12",
  "evaluation_window_end": "2024-04-11",
  "outcome_kind": "research_oos",
  "metrics": {
    "source_field": "trial_log.oos_sharpe",
    "window_convention": "WP-12aw / WP-S2c-14 uses the next prior contiguous equivalent-length non-cloned evaluation window, 2023-04-12 through 2024-04-11, as the first additional H-001 exp_success_criteria observation after the original full-period no-formal-split baseline. Indicators are warmed up on prior available history, but the backtest window starts flat with no pre-window position carry-in. The original H-001 REP-0002 evidence used a full-period retrospective posture, so strict non-overlap against that baseline is impossible; this package follows the later repo precedent of explicit non-cloned window disclosure for additional REP evidence.",
    "sharpe": -1.5649645357933155,
    "max_drawdown": 1.0,
    "n_obs": 1933,
    "trades": 9,
    "hit_rate": 0.2222222222222222,
    "profit_factor": 0.1780125823081104,
    "final_equity": 0.0,
    "total_pnl": -10000.0,
    "gross_pnl": -10689.140035137989,
    "fees_paid": 298.35384,
    "slippage_paid": 149.17692,
    "funding_paid": -1136.670795138,
    "cost_drag_fraction": 0.06447104564750925,
    "dsr": 0.0,
    "walk_forward_efficiency": 0.0,
    "gates_passed": 1,
    "gates_total": 8,
    "config_sha256": "9c5d85a68ae15853738e4204d2c6a231b35e97a77e275f287b37413fafd02035",
    "dataset_sha256": "9c52bdd9b90a5c4c3f3857ee39de6941f0bd6de038007dc712616f5d6618fb87",
    "dsr_note": "P(SR>1.0)=0.0000; SR benchmark=0.5862",
    "max_drawdown_peak": "2023-12-11 19:59:59.999000+00:00",
    "max_drawdown_trough": "2024-02-28 07:59:59.999000+00:00",
    "skipped_bars": 0,
    "sensitivity_min_ratio": -0.07639655084260967,
    "short_side_trades": 9,
    "short_side_net_pnl": -10898.73131513799,
    "long_side_trades": 0,
    "long_side_net_pnl": 0.0,
    "trial_count_before_append": 17,
    "trial_count_after_append": 18
  },
  "data_provenance": {
    "source_data_refs": [
      "data/processed/binance_um_perp_BTCUSDT_4h_2020-01-01_2026-04-11_2026-04-12T1655Z.parquet",
      "data/processed/binance_um_perp_BTCUSDT_funding_8h_2019-09-10_2026-04-12_2026-04-12T1655Z.parquet",
      "binance_um_perp_BTCUSDT_4h_2020-01-01_2026-04-11_2026-04-12T1655Z",
      "binance_um_perp_BTCUSDT_funding_8h_2019-09-10_2026-04-12_2026-04-12T1655Z"
    ],
    "source_data_window_start": "2023-04-12",
    "source_data_window_end": "2024-04-11",
    "source_data_notes": "OL-0018 derives from REP-0018. REP-0018 used the next prior contiguous equivalent-length non-cloned evaluation window after REP-0017 and REP-0016, covering 2023-04-12 through 2024-04-11. Indicators were warmed up on prior available history, and the backtest window started flat with no pre-window position carry-in. The original H-001 full-period baseline used a no-formal-split retrospective posture, so strict non-overlap against that baseline is impossible."
  },
  "derivation_record": {
    "derivation_method": "from_rep_artifact",
    "source_artifact_id": "REP-0018",
    "source_artifact_path": "research/experiments/REP-0018.report.json",
    "derivation_timestamp": "2026-05-19T17:48:34-06:00"
  },
  "pipeline_version": "pre_wp_5b",
  "linked_artifacts": [
    "EXP-0002",
    "REP-0018"
  ],
  "retrospective_flag": false,
  "linked_advisory_artifacts": [],
  "notes": "WP-12ax derives OL-0018 from REP-0018. It covers H-001 / research_oos / pre_wp_5b / downstream exp_success_criteria evidence production. REP-0018 records liquidation with final_equity = 0.0 and liquidation_timestamp = 2024-02-28 07:59:59.999000+00:00; OL v1 carries those facts here as descriptive notes because liquidated and liquidation_timestamp are not supported metrics fields. WP-12ax creates no REC, does not increase reconciliation_count, does not satisfy REC-5, and does not floor-cross the segment. It does not authorize paired-source reuse, H-005/H-006 work, Path B, EXP scaffold authoring, AUTO successor work, policy, scoring, ranking/recommendation, paper-live, runtime, lifecycle, promotion, demotion, protected-path authority, or downstream authority. REP-0018 next_step_recommendation is schema-required only and is not authority."
}
