{
  "schema_version": "v1",
  "outcome_id": "OL-0001",
  "candidate_id": "H-001",
  "lifecycle_state_during_window": "in_research",
  "evaluation_window_start": null,
  "evaluation_window_end": null,
  "outcome_kind": "research_oos",
  "metrics": {
    "sharpe": -0.3897788502290693,
    "source_field": "trial_log.oos_sharpe",
    "window_convention": "No separate IS/OOS split convention existed in repo truth; this object records full-period baseline metrics from DEC-0001 and the H-001 experiment notebook.",
    "max_drawdown": 1.7813160535564552,
    "n_obs": 13757,
    "trades": 104,
    "hit_rate": 0.5384615384615384,
    "profit_factor": 0.9220824891347528,
    "final_equity": 18638.78825637672,
    "total_pnl": 8638.78825637672,
    "gross_pnl": -5689.860000000022,
    "fees_paid": 2882.868112,
    "slippage_paid": 1441.434056,
    "funding_paid": -18652.950424376693,
    "cost_drag_fraction": 2.5182778234221295,
    "dsr": 0.0,
    "walk_forward_efficiency": 0.0,
    "gates_passed": 1,
    "gates_total": 8
  },
  "data_provenance": {
    "source_data_refs": [
      "4h OHLCV stream: ohlcv_4h",
      "8h funding-rate stream: funding_8h",
      "BTCUSDT 4h full history: data/processed/binance_um_perp_BTCUSDT_4h_2020-01-01_2026-04-11_2026-04-12T1655Z.parquet",
      "BTCUSDT funding rates full history: data/processed/binance_um_perp_BTCUSDT_funding_8h_2019-09-10_2026-04-12_2026-04-12T1655Z.parquet",
      "No separate IS/OOS split convention existed in repo truth for this baseline; DEC-0001 records full-period Sharpe in both trial-log Sharpe fields"
    ],
    "source_data_window_start": null,
    "source_data_window_end": null,
    "source_data_notes": "Copied from EXP-0002 data_requirements; no formal source-data window endpoints are committed for this baseline."
  },
  "derivation_record": {
    "derivation_method": "from_rep_artifact",
    "source_artifact_id": "REP-0002",
    "source_artifact_path": "research/experiments/REP-0002.report.json",
    "derivation_timestamp": "2026-05-04T17:31:24Z"
  },
  "pipeline_version": "pre_wp_5b",
  "linked_artifacts": [
    "EXP-0002",
    "REP-0002"
  ],
  "retrospective_flag": true,
  "linked_advisory_artifacts": [],
  "notes": "WP-9m seed selected H-001 / REP-0002 because the candidate, EXP, REP, metrics, no-formal-split windows, and pre-WP-5b pipeline semantics are unambiguous in committed repo truth.",
  "retrospective_disclosure": "WP-9m derives this seed outcome-ledger artifact after the fact from the already committed REP-0002 report to validate the outcome-ledger schema, validator, and query-layer path before bulk retrospective backfill. This is one seed instance only, not the full H-001 through H-010 retrospective backfill. It carries no promotion, demotion, policy, REC/reconciliation, paper/live, runtime, deployment, strategy adjustment, or protected-path authority."
}
